{
  "schema_version": 2,
  "id": "1757250010001",
  "path": "Content/Verse/Shop/shop.verse",
  "saved_at": 1757250010,
  "bytes": 1432,
  "preview": "using { /Fortnite.com/Devices }",
  "content_hash": "0b2c4d6e8f1a3c5e",
  "content": "using { /Fortnite.com/Devices }\n\nshop_device := class(creative_device):\n    OnBegin<override>()<suspends>:void=\n        Print(\"shop\")\n",
  "source": "agent",
  "run_id": "3f2b9c1e-6d4a-4c0b-9e1f-0a1b2c3d4e5f",
  "conv_id": "conv-hacker-01",
  "profile_id": "hacker",
  "ducky_name": "Hacker",
  "model": "anthropic:claude-sonnet-5",
  "tool": "workspace_write_file",
  "group_id": "conv-hub-01",
  "coding_agent": "ducky"
}
